"gene_ID","A.thaliana_p_val","A.thaliana_avg_log2FC","A.thaliana_pct.1","A.thaliana_pct.2","A.thaliana_p_val_adj","C.hirsuta_p_val","C.hirsuta_avg_log2FC","C.hirsuta_pct.1","C.hirsuta_pct.2","C.hirsuta_p_val_adj","max_pval","minimump_p_val","CH_ID","TF","TF_family","Gene_code_name","Gene_functions"
"AT4G27860",0,0.341182796945056,0.244,0.028,0,0,0.868567625509745,0.534,0.074,0,0,0,"Chir07Ox-b25040.2",NA,NA,"MEB1","cellular manganese ion homeostasis, endoplasmic reticulum, ER body, intracellular sequestering of iron ion, iron ion transmembrane transporter activity, manganese ion transmembrane transporter activity, membrane, nucleus, protein binding"
"AT1G52040",0,2.7802068233428,0.894,0.177,0,0,3.57160274809734,0.693,0.053,0,0,0,"Chir01Ox-b40890.2",NA,NA,"ATMBP","cytoplasm, defense response, nucleus, plant-type vacuole"
"AT1G52410",0,2.42032355404301,0.873,0.211,0,0,2.44589557488617,0.867,0.147,0,0,0,"Chir01Ox-b41240.2",NA,NA,"AtTSA1","calcium ion binding, chloroplast, chloroplast thylakoid membrane, defense response to fungus, nucleus, peroxisome, photomorphogenesis, plant-type vacuole, protein binding, secretory vesicle"
"AT1G44350",0,0.945887076842172,0.715,0.228,0,1.18464736712326e-123,0.45803691910084,0.525,0.197,2.17465717182818e-119,1.18464736712326e-123,0,"Chir01Ox-b35080.2",NA,NA,"AT1G44350.1","auxin metabolic process, chloroplast, hydrolase activity, IAA-amino acid conjugate hydrolase activity, jasmonic acid metabolic process, jasmonyl-Ile conjugate hydrolase activity, regulation of systemic acquired resistance, response to jasmonic acid"
"AT1G52400",0,2.94732166877117,0.93,0.28,0,0,3.7253942227545,0.827,0.147,0,0,0,"Chir01Ox-b41230.2",NA,NA,"BGL1","abscisic acid glucose ester beta-glucosidase activity, abscisic acid metabolic process, beta-glucosidase activity, carbohydrate metabolic process, chloroplast, defense response to fungus, endoplasmic reticulum, ER body, extracellular region, glucosinolate catabolic process, identical protein binding, nucleus, peroxisome, plant-type vacuole, plasmodesma, positive regulation of abscisic acid-activated signaling pathway, regulation of stomatal movement, response to abscisic acid, response to insect, response to salt stress, response to water deprivation, water homeostasis"
"AT5G24420",0,3.43205991384475,0.931,0.331,0,1.13806680909086e-273,1.49508201591728,0.758,0.285,2.08914924144809e-269,1.13806680909086e-273,0,"Chir06Ox-b15290.2",NA,NA,"PGL5","6-phosphogluconolactonase activity, carbohydrate metabolic process, cytoplasm, cytosol, pentose-phosphate shunt, oxidative branch"
"AT3G45140",0,2.57921317221719,0.986,0.517,0,0,2.74208029355641,0.901,0.122,0,0,0,"Chir05Ox-b29240.2",NA,NA,"AT3G45140.2","chloroplast, chloroplast envelope, chloroplast stroma, chloroplast thylakoid membrane, cytoplasm, cytosol, green leaf volatile biosynthetic process, jasmonic acid biosynthetic process, linoleate 13S-lipoxygenase activity, lipid oxidation, mRNA binding, oxidoreductase activity, acting on single donors with incorporation of molecular oxygen, incorporation of two atoms of oxygen, oxylipin biosynthetic process, protein binding, response to bacterium, response to fungus, response to herbivore, response to jasmonic acid, response to other organism, response to water deprivation, response to wounding, salicylic acid binding"
"AT3G28220",0,2.77159829980578,0.981,0.645,0,0,3.28477628479309,0.854,0.077,0,0,0,"Chir05Ox-b05920.2",NA,NA,"AT3G28220.1","alpha-amino acid metabolic process, amine metabolic process, cellular component assembly, chloroplast envelope, cytosol, nucleus, plant-type vacuole, response to jasmonic acid, response to wounding, secondary metabolic process"
