"gene_ID","CH_ID","Gene_code_name","avg_log2FC","pct.1","pct.2","coefficient","rank","p_val","p_val_adj","TF","TF_family","Gene_functions","source"
"AT1G45201","Chir01Ox-b35540.2","ATTLL1",1.88794749653455,0.185,0.017,0.469827403919667,1,0,0,NA,NA,"carboxylic acid metabolic process, defense response to other organism, extracellular region, flavonoid biosynthetic process, glucosinolate metabolic process, lipid metabolic process, nucleus, plant-type cell wall biogenesis, plant-type vacuole, regulation of defense response, response to abscisic acid, response to inorganic substance, response to jasmonic acid, response to light stimulus, response to wounding, secretory vesicle, triglyceride lipase activity","GEP_24"
"AT4G16515","Chir07Ox-b13210.2","GLV1",0.538081762221434,0.19,0.025,0.293710680782575,2,0,0,NA,NA,"cell differentiation, extracellular region, extracellular space, growth factor activity, hormone activity, lateral root development, mitochondrion, positive gravitropism, positive regulation of cell population proliferation, regulation of asymmetric cell division, regulation of auxin polar transport, regulation of lateral root development, regulation of protein localization, regulation of root development, regulation of root meristem growth, regulation of root morphogenesis, response to auxin, root system development","GEP_24"
"AT1G13110","Chir01Ox-b13070.2","CYP71B7",0.506731308794419,0.185,0.025,0.212455478201464,3,0,0,NA,NA,"alpha-amino acid metabolic process, chloroplast, defense response to bacterium, defense response to fungus, heme binding, immune system process, iron ion binding, organic acid biosynthetic process, oxidoreductase activity, acting on paired donors, with incorporation or reduction of molecular oxygen, response to light stimulus, signal transduction","GEP_24"
"AT4G25830","Chir07Ox-b22870.2","AT4G25830.1",1.06912074294208,0.269,0.031,0.40096934425248,4,0,0,NA,NA,"4 iron, 4 sulfur cluster binding, extracellular region, plasma membrane, response to light stimulus","GEP_24"
"AT1G58270","Chir07Ox-b03220.2","AT1G58270.1",1.29560945121279,0.231,0.034,0.517761236353309,5,0,0,NA,NA,"carbohydrate derivative metabolic process, cell differentiation, cellular lipid metabolic process, defense response to other organism, developmental growth, lipid biosynthetic process, monocarboxylic acid metabolic process, nucleus, organic acid biosynthetic process, plant epidermis development, plant-type cell wall biogenesis, plasmodesma, response to alcohol, response to organonitrogen compound, response to water deprivation, response to wounding, root morphogenesis","GEP_43"
"AT4G02850","Chir08Ox-b03090.2","DAAR1",1.23452778551883,0.2,0.035,0.514909559299238,6,0,0,NA,NA,"amino-acid racemase activity, biosynthetic process, cytoplasm, isomerase activity, tissue development","GEP_24"
"AT4G22690","Chir07Ox-b19390.2","CYP706A1",0.776420738959199,0.186,0.036,0.356772543095276,7,0,0,NA,NA,"chloroplast, defense response to bacterium, defense response to fungus, Golgi apparatus, heme binding, hormone-mediated signaling pathway, immune system process, iron ion binding, mitochondrion, oxidoreductase activity, acting on paired donors, with incorporation or reduction of molecular oxygen, oxoacid metabolic process, plant-type cell wall, plant-type vacuole, regulation of signal transduction, response to abscisic acid, response to chitin, response to organic cyclic compound, response to water deprivation, secondary metabolic process","GEP_24"
"AT5G55620","Chir08Ox-b17580.2","MDF20.6",1.00638805882304,0.288,0.038,0.426101415507358,8,0,0,NA,NA,"cell differentiation, cellular_component, molecular_function, phyllome development, plant organ morphogenesis, response to light stimulus, vitamin metabolic process","GEP_43"
"AT4G37800","Chir07Ox-b35240.2","XTH7",0.417197800103052,0.198,0.049,0.291451182393603,9,6.46564429716436e-301,1.18689832363046e-296,NA,NA,"cell wall biogenesis, cellular component biogenesis, extracellular region, hydrolase activity, hydrolyzing O-glycosyl compounds, plant-type cell wall organization or biogenesis, polysaccharide binding, xyloglucan metabolic process, xyloglucan:xyloglucosyl transferase activity","GEP_24"
"AT4G15760","Chir07Ox-b12250.2","AT4G15760.1",0.704119494077595,0.42,0.051,0.186787523522635,10,0,0,NA,NA,"endoplasmic reticulum, FAD binding, mitochondrion, response to fungus","GEP_24"
"AT4G14550","Chir07Ox-b10470.2","SLR",1.03696685238524,0.378,0.054,0.229376601603972,11,0,0,NA,NA,"DNA-binding transcription factor activity, lateral root morphogenesis, negative regulation of DNA-templated transcription, nucleus, protein binding, regulation of DNA-templated transcription, response to auxin, transcription cis-regulatory region binding","GEP_43"
"AT3G08770","Chir03Ox-b07970.2","AtLtpI-6",2.70005204002011,0.581,0.058,0.314627494820139,12,0,0,NA,NA,"extracellular region, lipid transport, response to water deprivation","GEP_24"
"AT5G15310","Chir06Ox-b24060.2","ATMYB16",1.0917769700805,0.556,0.066,0.324562950120662,13,0,0,"Yes","MYB","cell morphogenesis, cuticle pattern formation, DNA-binding transcription factor activity, nucleus, regulation of cutin biosynthetic process","GEP_43"
"AT3G51600","Chir05Ox-b16920.2","AT3G51600.1",2.93452821032215,0.469,0.073,0.22800636476595,14,0,0,NA,NA,"cytosol, extracellular region, lipid transport, lipid transporter activity, plant-type cell wall, plasmodesma","GEP_43"
"AT1G51500","Chir01Ox-b40390.2","CER5",1.06317508824886,0.694,0.083,0.15446789688834,15,0,0,NA,NA,"ABC-type transporter activity, ATPase-coupled transmembrane transporter activity, defense response to virus, efflux transmembrane transporter activity, endoplasmic reticulum, export from cell, plasma membrane, protein binding, response to abscisic acid, response to salt stress, transmembrane transport, wax biosynthetic process","GEP_43"
"AT5G14410","Chir06Ox-b24990.2","F18O22.200",1.04918343270959,0.673,0.083,0.164604148123872,16,0,0,NA,NA,"biological_process, mitochondrion, molecular_function","GEP_43"
"AT1G01610","Chir01Ox-b00640.2","ATGPAT4",0.923356511786361,0.679,0.088,0.143555563714522,17,0,0,NA,NA,"chloroplast, cutin biosynthetic process, glycerol-3-phosphate 2-O-acyltransferase activity, membrane, phosphatase activity, sn-2-glycerol-3-phosphate omega-OH-C22:0-CoA acyl transferase activity","GEP_43"
"AT1G78850","Chir02Ox-b25980.2","GAL1",1.27719157235031,0.314,0.089,0.228164335187519,18,0,0,NA,NA,"apoplast, cellular response to hypoxia, extracellular region, glycosaminoglycan binding, Golgi apparatus, mitochondrion, plant-type cell wall, plant-type vacuole, response to sodium phosphate, secretory vesicle","GEP_24"
"AT5G20270","Chir06Ox-b18750.2","AT5G20270.1",1.22298697509901,0.718,0.089,0.120355185644433,19,0,0,NA,NA,"negative regulation of abscisic acid-activated signaling pathway, nucleus, response to hormone, response to salt stress, response to sucrose, signaling receptor activity","GEP_43"
"AT1G64670","Chir02Ox-b00160.2","CED1",1.12568591777006,0.739,0.093,0.131076475061928,20,0,0,NA,NA,"chloroplast, cuticle development, cutin biosynthetic process, cytoplasm, defense response to fungus, lateral root development, nucleus, plant-type cell wall, positive regulation of cutin biosynthetic process, positive regulation of response to water deprivation, regulation of abscisic acid biosynthetic process, response to abscisic acid, response to osmotic stress, suberin biosynthetic process, transpiration","GEP_43"
