"gene_ID","A.thaliana_p_val","A.thaliana_avg_log2FC","A.thaliana_pct.1","A.thaliana_pct.2","A.thaliana_p_val_adj","C.hirsuta_p_val","C.hirsuta_avg_log2FC","C.hirsuta_pct.1","C.hirsuta_pct.2","C.hirsuta_p_val_adj","max_pval","minimump_p_val","CH_ID","TF","TF_family","Gene_code_name","Gene_functions"
"AT4G23550",0,1.27518509120294,0.37,0.014,0,0,2.06159027935338,0.459,0.005,0,0,0,"Chir07Ox-b20540.2","Yes","WRKY","WRKY29","DNA-binding transcription factor activity, nucleus, transcription cis-regulatory region binding"
"AT3G25710",0,1.2961668789392,0.335,0.023,0,0,1.46127977313819,0.515,0.044,0,0,0,"Chir05Ox-b02980.2","Yes","bHLH","ATAIG1","anthocyanin-containing compound biosynthetic process, cellular response to phosphate starvation, DNA-binding transcription factor activity, nucleus, protein binding, protein dimerization activity, regulation of DNA-templated transcription, root development, root hair cell development"
"AT5G08070",7.41350224259353e-194,0.587552428262717,0.245,0.027,1.3608966066729e-189,2.08923936116972e-232,0.281303014472939,0.165,0.015,3.83521669529926e-228,7.41350224259353e-194,4.17847872233913e-232,"Chir06Ox-b30930.2","Yes","TCP","TCP17","cell differentiation, DNA-binding transcription factor activity, leaf development, leaf morphogenesis, leaf senescence, nucleus, positive regulation of development, heterochronic, protein binding, regulation of DNA-templated transcription, sequence-specific DNA binding"
"AT1G69310",0,0.534963430260698,0.247,0.006,0,0,0.368228881104036,0.239,0.012,0,0,0,"Chir02Ox-b15720.2","Yes","WRKY","WRKY57","DNA-binding transcription factor activity, nucleus, regulation of DNA-templated transcription, response to osmotic stress, response to salt stress, response to water deprivation, sequence-specific DNA binding, transcription cis-regulatory region binding"
"AT2G24260",6.02308807922005e-203,0.364155278979207,0.17,0.012,1.10565827870242e-198,0,0.701409726858982,0.432,0.028,0,6.02308807922005e-203,0,"Chir04Ox-b06770.2","Yes","bHLH","LRL1","DNA-binding transcription factor activity, DNA-binding transcription factor activity, RNA polymerase II-specific, microgametogenesis, nucleus, pollen sperm cell differentiation, protein binding, protein dimerization activity, regulation of DNA-templated transcription, regulation of transcription by RNA polymerase II, RNA polymerase II cis-regulatory region sequence-specific DNA binding, root hair cell development, root hair cell differentiation, root hair elongation, transcription cis-regulatory region binding"
